description_id,sentence,cluster,cluster_type,n_tokens
10,"‘You are able to be more independent, and work with a like-minded group who also want to do well.",31,transferrable,24
10,You get to learn from a script and perform to a live audience.,38,content,14
11,"Qualification Type GCSE Examination Board AQA Students learn to collaborate with others, think analytically and evaluate effectively.",17,logistics,19
11,"They gain the confidence to pursue their own ideas, reflect and refine their efforts.",31,transferrable,16
11,"Whatever the future holds, students of GCSE Drama emerge with a toolkit of transferable skills, applicable both in further studies and in the workplace.",0,content,27
11,"What is the course like and what will be studied Students will explore Drama and theatre as a practical art form in which ideas and meaning are communicated to an audience through choices of form, style and convention.",39,content,40
11,"Students will create, perform and respond to Drama informed by their theoretical knowledge of drama and theatre.",48,motivation,19
11,The subject content for GCSE Drama is divided into three components:,0,content,12
11,Understanding Drama Devising Drama Texts in practice,34,content,7
11,How will the course be assessed Component 1: Understanding drama,34,content,11
11,The written paper constitutes 40% of the GCSE.,16,logistics,10
11,Devising drama Individual Devising Log and performance 40% of the GCSE.,0,content,13
11,The Devising log is marked out of 60 and the individual performance is marked out of 20.,16,logistics,18
11,Component 3: Texts in practice,15,logistics,6
11,"This component is a practical component in which students are assessed on their ability to apply theatrical skills to realise artistic intentions in live performance, and constitutes 20% of the GCSE.",38,content,34
11,"If you wish to continue studying Drama at a higher level, then studying GCSE Drama will prepare you for higher education such as A Level Drama.",0,content,28
11,"If you wish to pursue Drama as a career option then there are a number of routes that you can take such as acting, directing, teaching, stage management, costume design, set construction, lighting and sound technical work to name a few. ""}",35,motivation,50
11,"{""https://www.clrchs.co.uk/"",""BTEC",10,logistics,4
11,"Arts is about learning how the dramatic process works, how to use dramatic technique to explore themes and issues and a playwright’s intention.",39,content,26
11,It is also about how to create a character and perform using a variety of styles and genres.,37,motivation,19
11,Students will explore a various script and devising techniques throughout the course.,20,transferrable,13
11,Students will be assessed on 3 units:,19,logistics,8
11,Unit 1: Exploring the Performing Arts ( internally assessed),22,content,11
11,Unit 2: Developing Skills and Techniques for Performance (internally assessed),8,content,13
11,"Unit 3: Performing to a Brief ( external assessment) Students will get the opportunity to attend theatre performances and workshops to further develop their skills.""}, {""http://www.brimsham.com/"",""At Brimsham Green School, Drama is a highly valued and popular subject across the key stages.",39,content,53
11,"All students study this subject during Key Stage 3, where alongside learning technical skills and the basics of acting and theatre, we also see students develop in confidence, leadership skills and team work.",38,content,37
11,"We give all students the opportunity to create drama, rehearse, watch and perform drama within a supportive and motivating environment.",48,motivation,23
11,Students who continue to study the subject into GCSE and A Level find the course stimulating and enjoyable and relish the opportunity for independent learning.,0,content,26
11,"They grow in their ability and desire to perform as the course progresses and our outcomes are very successful both in terms of grades and in what students have gained personally from the experience of studying Drama.""}, {""https://www.sandysecondaryschool.com/"",""Not only does Drama develop performance skills, a love of theatre and acting, harness confidence and the ability to lead and work in a team, it also develops presentation skills that are important in selling yourself as a young professional within both the initial interview processes as well as at further stages in your career.",48,motivation,104
11,"The cross- curricular links in regard to textual analysis enable and empower students to succeed in other areas of their school career, from both an understanding of politics and political and social structure, to their understanding of English literature.",6,content,43
11,Course Units and Content: Component 1– Devising: •,27,logistics,11
11,Create and develop a devised piece from a stimulus for performance.,14,logistics,12
11,You can choose to be a performer or designer throughout this unit.,37,motivation,13
11,You will complete a portfolio covering the creating and developing process and analysis and evaluation.,6,content,16
11,The portfolio can be either.... • handwritten/typed evidence between 1500–2000 words •,6,content,15
11,recorded/verbal evidence between 8–10 minutes •,12,logistics,8
11,a combination of handwritten/typed evidence.,12,logistics,8
11,Component 2– Performance from a Text: •,15,logistics,9
11,You will either perform in and/or design for two key extracts from a performance piece.,15,logistics,18
11,The choice of piece is up to you!,32,content,9
11,Component 3– Theatre Makers in Practice: •,41,content,9
11,Written examination on your practical exploration and study of one performance text (An Inspector Calls) and a live theatre evaluation (this year students had the opportunity to see ‘The Curious Incident of the Dog in the Night-Time in London’s West End).,33,content,50
11,Assessment: Component 1: 40% of the qualification 60 marks Component 2: 20% of the qualification 48 marks Component 3: 40% of the qualification 60 marks,17,logistics,32
12,"Two Specialist spaces for Drama and Theatre Studies, with purpose built raked seating, fully equipped with lighting rigs and sound systems.",42,content,24
12,"Break off areas for teaching and learning in theatrical design elements of courses (i.e makeup design, lighting, props and sound).",39,content,25
12,"A Dedicated Dance Studio with a sprung wooden floor , mirrors, visual/ audio equipment and resource cupboard Fully resourced Music department, with independent practice rooms and a wide range of instrumental classes available.",22,content,37
12,We go on theatre trips with every exam course to provide applied learning experiences.,40,content,15
12,"We have a rich and dynamic extra-curricular programme for all students (i.e. Musical, Drama Club, school productions, Touring Theatre Company and showcases).",39,content,28
12,We have something for everyone.,26,transferrable,6
12,"Drama encourages students to develop critical thinking skills, and become effective and independent learners.",48,motivation,16
12,"There is a strong focus on working imaginatively, collaborating creatively and communicating effectively.",31,transferrable,15
12,"Students study all aspects of Drama and Theatre studies including devising, directing, and performing through practical and written work.",48,motivation,22
12,"The departments offers extra curricular opportunities including a weekly drama club leading to involvement in the annual drama showcase (where students can also perform their GCSE and A-Level work), the school musical and theatre trips.",39,content,41
12,The department has educational links to the college and university to provide workshops.,13,content,14
12,GCSE – 100% pass rate for many years.,16,logistics,10
12,GCSE Drama provides a solid foundation for further Drama studies and vocational opportunities.,0,content,14
12,Students who have study Drama at GCSE have the opportunity to continue to study Drama and Theatre studies as an A level in 6th form.,0,content,26
12,"A-Level – 100% pass rate for many years.Students have continued to study Drama and Theatre studies at university and gain scholarships for acting schools (Bristol, Leicester and ALRA).""}, {""http://www.budehaven.cornwall.sch.uk/"",""We believe that Drama is a vital and defining cultural art form.",35,motivation,56
12,"Throughout time, human beings have enacted events in order to help us make sense of the complex world we live in.",31,transferrable,23
12,We structure lessons that strike a balance between exploring process drama (learning by imagined experience) and product or skills based drama – the craft of theatre making.,47,content,30
12,We develop schemes of work that provoke engagement and enthusiasm through our choice of theme and topic and apply early in our teaching the principles and assessment criteria that the exam boards recognise.,22,content,34
12,"Our lessons typically start with a starter or warm up, an introduction to the stimulus, a focusing convention or strategy that frames the whole group or small group work and an opportunity to create, perform and evaluate in a welcoming, safe and supportive studio environment.""}, {""https://www.aldercarhigh.co.uk/curriculum/"",""Do you have a passion for performance?",25,content,65
12,"Are you a budding actor, dancer or musician?",37,motivation,10
12,"Do you want to discover more about the fantastic roles behind the scenes – from costume design and make-up, to set design and lighting?",37,motivation,28
12,"You can choose the music, drama, dance or backstage projects as you com- plete this course.",39,content,20
12,"You will develop a range of skills which are attractive to employers, colleges and universities includ- ing: Communication, Confidence, Learning independently, Organisation, Problem solving, Research, Self-discipline, Stamina, Taking on responsibility and Time management..",30,motivation,47
12,"Music, Drama or combined pathways available.""}, {""http://www.beauchamps.essex.sch.uk"",""",35,motivation,17
12,The students study play texts such as Willy Russell’s Blood Brothers.,32,content,13
12,Drama skills and knowledge are expanded with an emphasis on creating atmosphere; this can be seen through our performance for purpose focus at the end of the year which incorporated script and film.,47,content,35
12,Drama techniques are also developed through all topics and improvisation and movement sessions encourage students to use imagination when attempting to create dramatic meaning.,47,content,25
12,We believe it is important to offer students a wide range of stimuli to work with and to engage them through variety and style.,25,content,25
12,"Year 9 During this year students continue to develop communication skills through group discussions and practical development, but they also begin to investigate more challenging texts and themes through the process of Drama.",48,motivation,35
12,Students look at the play text DNA by Dennis Kelly and explore the issues and challenges that can arise within peer groups.,32,content,23
12,Students explore the text using a variety of drama techniques and then students confront and explore social issues and themes such as peer pressure and belonging.,48,motivation,27
12,"Throughout years 7,8 and 9 in addition to practical tasks there is an opportunity for students to gain experience with technical aspects of theatre and direction to ensure all aspects available where needed.",38,content,35
12,GCSE The GCSE Drama course (Eduqas) is an active and diverse course which allows the students to expand their knowledge and understanding of theatre through a range of texts.,0,content,32
12,"The course introduces the students to different theatre styles and theatre practitioners, via a range of workshops.",39,content,19
12,"These workshops are the basis for Component 1 where they must devise their own piece of work for performance, create a portfolio detailing this process and then complete a written report evaluating the final performance.",5,content,37
12,"In Component 2 students study a text such as Blood Brother (Willy Russell), The Woman Who Cooked Her Husband (Debbie Issitt), Top Girls (Caryl Churchill) and then perform extracts from this to an external examiner.",32,content,44
12,The final section is Component 3 which is a written examination based on a set text (DNA – Dennis Kelly) and live theatre review.,9,logistics,27
12,Throughout the course students are given the opportunity to attend theatre trips to provide a resource for their live theatre evaluation and are presented with workshops by external companies to aid their development in specific performance styles.,40,content,38
12,"Key life skills learnt throughout the course will arm students with a variety of skills that employers are currently desperate for including professionalism, resilience and independence.",30,motivation,28
12,We aim to develop inclusion for all and offer non-practical elements such as costume design for students who want to gain a wider understanding of the performing arts industry.,25,content,30
12,"""}, {""https://www.haydonbridgehigh.co.uk/"",""Years 10, 11 Dance and Drama QUALIFICATION: BTEC AWARD IN PERFORMING (DANCE 23095)",10,logistics,25
12,AWARDING BODY: PEARSON EDEXCEL,18,logistics,5
12,What will I learn?,4,content,5
12,You will develop key skills that show your aptitude in performing arts such as reproducing repertoire or responding to stimuli.,24,content,21
12,"You will learn the process that underpins effective ways of working in the performing arts, such as development of ideas, rehearsal and performance.",24,content,26
12,"You will learn about the attitudes that are considered most important in the Performing Arts, including personal management and communication.",24,content,22
12,How will I learn?,4,content,5
12,You will work creatively in a group to shape and perform in a piece of live theatre and keep a record of your contributions to the devising process.,38,content,29
12,This record will be part of your portfolio which will also include annotated sketches/photographs.,6,content,17
12,You will learn about physical and interpretive skills by taking part in dance workshops and by watching professional dancers in live theatre performances.,24,content,24
12,You will practically explore and research a range of dance pieces.,24,content,12
12,"You will take part in theatre visits, discuss what you have seen and learn how to write a performance review.",33,content,22
12,How will I be assessed?,1,logistics,6
12,"Component 1: Exploring the performing arts (dance) Internal assessment [30%] Component 2: Developing skills and techniques Internal assessment [30%] Component 3: Responding to a brief Externally assessed [40%] Possible Careers/Future Pathways: BTEC in performing arts could lead on to further study in performing arts, theatre studies, and Expressive Arts at A-level and above, or other related subjects such as English, music, art and design.",22,content,89
12,"Career opportunities for students who study performing arts at a higher level include: the media, theatre, television, radio, the film industry, arts administration, drama therapy, education.""}, {""https://www.habsknights.org.uk/"",""Component",7,motivation,44
12,1: Understanding Drama • Section A –,34,content,8
12,"Roles in the theatre, stage spaces, terminology •",42,content,10
12,Set text: Noughts and Crosses •,15,logistics,7
12,Evaluation of live performance Component 2: Devising Drama –,34,content,10
12,Devising an original performance from stimulus with a coursework portfolio and reflective evaluation –,6,content,14
12,You can opt for the acting or technical pathway Component 3: Texts in practice Performance of 2 extracts of a scripted play –,42,content,24
12,"You can opt for the acting or technical pathway""}, {""https://arkglobe.org/"",""Drama",35,motivation,18
12,Exam Board: AQA Subject Leader: Ms Alonge,17,logistics,9
12,What is the subject about?,8,content,6
12,"Drama GCSE is an opportunity for young people to explore challenging themes, topics and issues through performance.",0,content,19
12,It allows students to grow in public speaking and builds effective team work over time.,23,transferrable,16
12,During the course students will be expected to study a variety of plays and explore a wide range of different theatre styles.,39,content,23
12,During the course students will be expected to write theatre reviews and keep an extended diary of their practical work each lesson.,39,content,23
12,This is used as a reflection to develop exam knowledge.,17,logistics,11
12,"Drama GCSE will help to develop practical skills, enhance imagination and explore creativity.",0,content,15
12,Students will devise performances from topics or ideas suggested by the teacher or by the students themselves.,25,content,18
12,Where will this qualification take me?,30,motivation,7
12,"Students will develop a multitude of skills, including collaboration, communication and an understanding of how to amend and refine work in order to make a smooth transition to the next level of study.",23,transferrable,36
12,Drama will give you the skills to present yourself in any type of business or organisation you choose.,44,transferrable,19
12,"Candidates who study Drama go on to work in a range of jobs and careers from acting, stage and screen, to business and leadership.",35,motivation,27
12,Roles involving writing plays are also possible.,35,motivation,8
12,Component 1: Understanding Drama (40%) Practical exploration and study of one set text and one live theatre review •,34,content,23
12,Component 2: Devising (40%) Creating and developing a devised piece from a stimulus and performing this devised piece. •,9,logistics,24
12,Component 3: Text in Performance (20%) Performing two key extracts from a performance text.,15,logistics,19
12,"""}, {""https://www.habscrayford.org.uk/"",""BTEC",10,logistics,8
12,Performing Arts Exam Board: Pearson Grade: Level 2,10,logistics,10
12,"The performing arts is a fantastic discipline to pursue if you are interested in developing confidence and skills in public speaking, group work, creativity, time management and leadership to name only a few.",24,content,37
12,"This qualification is for anyone with a passion for theatre, but you do not have to be an aspiring actor to reap the benefits of selecting BTEC Performing Arts as an option.",10,logistics,34
12,This qualification builds upon skills and content primarily learnt during key stage 3 Drama lessons.,47,content,17
12,Component 1: Developing Skills for Performance is our first assessment which will involve participating in workshops linked to practitioners.,13,content,21
12,"You will apply these skills to a scripted piece, performing to an invited audience. •",38,content,17
12,Component 2: Exploring Performing,5,content,5
12,Arts is our second assessment which will be a combination of coursework and practical work. •,22,content,17
12,"Component 3: Performing to a Brief is our third and final assessment which takes place in three areas; performance, coursework and a controlled assessment.",5,content,28
12,Preparing for Success in Performing Arts,24,content,6
12,To be successful students must be organised and manage their time well as there will be a number of deadlines to meet throughout the course.,21,transferrable,26
12,Students should also be willing to share their creative ideas as well as listen and respond to the suggestions made by others.,25,content,23
12,It is vital that they are supportive of their peers and are ready to build new relationships and work closely with others. •,31,transferrable,24
12,Component 1: Developing Skills and Techniques in the Performing Arts- 30%,22,content,14
12,The entire process will be documented through analytical and evaluative coursework. •,19,logistics,13
12,Component 2: Exploring the Performing Arts- 30%,22,content,10
12,This is a practical exploration of different performance styles and industry jobs chronicled through coursework culminating in an assessed presentation of your findings. •,26,transferrable,25
12,Component 3: Performing to a Brief- 40%,5,content,10
12,An externally set task where you will work in groups of 3-7 to create a performance based on a set brief.,14,logistics,24
12,"Assessment is based on coursework, performance and an evaluative report written under controlled conditions.",19,logistics,16
12,Future pathways Students will have a better understanding of whether the performing arts sector is for them.,7,motivation,18
12,"They may want to go on to further study such as A levels, BTECs or a mixture of both.",28,logistics,21
12,"Or students might want to find work in teaching, performing arts or as an apprentice or a trainee.",7,motivation,20
13,"BTEC Level 2 Performing Arts is about learning how the dramatic process works, how to use dramatic technique to explore themes and issues and a playwright’s intention.",10,logistics,30
13,It is also about how to create a character and perform using a variety of styles and genres.,37,motivation,19
13,Students will explore a various script and devising techniques throughout the course.,20,transferrable,13
13,Students will be assessed on 3 units:,19,logistics,8
13,Unit 1: Exploring the Performing Arts ( internally assessed),22,content,11
13,Unit 2: Developing Skills and Techniques for Performance (internally assessed),8,content,13
13,Unit 3: Performing to a Brief ( external assessment),5,content,11
13,Students will get the opportunity to attend theatre performances and workshops to further develop their skills.,40,content,17
14,"At Brimsham Green School, Drama is a highly valued and popular subject across the key stages.",48,motivation,18
14,"All students study this subject during Key Stage 3, where alongside learning technical skills and the basics of acting and theatre, we also see students develop in confidence, leadership skills and team work.",38,content,37
14,"We give all students the opportunity to create drama, rehearse, watch and perform drama within a supportive and motivating environment.",48,motivation,23
14,Students who continue to study the subject into GCSE and A Level find the course stimulating and enjoyable and relish the opportunity for independent learning.,0,content,26
14,They grow in their ability and desire to perform as the course progresses and our outcomes are very successful both in terms of grades and in what students have gained personally from the experience of studying Drama.,48,motivation,38
15,"Not only does Drama develop performance skills, a love of theatre and acting, harness confidence and the ability to lead and work in a team, it also develops presentation skills that are important in selling yourself as a young professional within both the initial interview processes as well as at further stages in your career.",47,content,59
15,"The cross- curricular links in regard to textual analysis enable and empower students to succeed in other areas of their school career, from both an understanding of politics and political and social structure, to their understanding of English literature.",6,content,43
15,Course Units and Content: Component 1– Devising: •,27,logistics,11
15,Create and develop a devised piece from a stimulus for performance.,14,logistics,12
15,You can choose to be a performer or designer throughout this unit.,25,content,13
15,You will complete a portfolio covering the creating and developing process and analysis and evaluation.,6,content,16
15,The portfolio can be either.... • handwritten/typed evidence between 1500–2000 words •,6,content,15
15,recorded/verbal evidence between 8–10 minutes •,12,logistics,8
15,a combination of handwritten/typed evidence.,12,logistics,8
15,Component 2– Performance from a Text: •,15,logistics,9
15,You will either perform in and/or design for two key extracts from a performance piece.,15,logistics,18
15,The choice of piece is up to you!,32,content,9
15,Component 3– Theatre Makers in Practice: •,41,content,9
15,Written examination on your practical exploration and study of one performance text (An Inspector Calls) and a live theatre evaluation (this year students had the opportunity to see ‘The Curious Incident of the Dog in the Night-Time in London’s West End).,33,content,50
15,Assessment: Component 1: 40% of the qualification 60 marks Component 2: 20% of the qualification 48 marks Component 3: 40% of the qualification 60 marks,17,logistics,32
16,We believe that Drama is a vital and defining cultural art form.,47,content,13
16,"Throughout time, human beings have enacted events in order to help us make sense of the complex world we live in.",31,transferrable,23
16,We structure lessons that strike a balance between exploring process drama (learning by imagined experience) and product or skills based drama – the craft of theatre making.,47,content,30
16,We develop schemes of work that provoke engagement and enthusiasm through our choice of theme and topic and apply early in our teaching the principles and assessment criteria that the exam boards recognise.,22,content,34
16,"Our lessons typically start with a starter or warm up, an introduction to the stimulus, a focusing convention or strategy that frames the whole group or small group work and an opportunity to create, perform and evaluate in a welcoming, safe and supportive studio environment.",25,content,50
17,Do you have a passion for performance?,24,content,8
17,"Are you a budding actor, dancer or musician?",37,motivation,10
17,"Do you want to discover more about the fantastic roles behind the scenes – from costume design and make-up, to set design and lighting?",37,motivation,28
17,"You can choose the music, drama, dance or backstage projects as you com- plete this course.",39,content,20
