description_id,sentence,cluster,cluster_type,n_tokens
0,Component 1: Devising: Create and perform a devised piece from a stimulus.,14,logistics,15
0,"A portfolio covering the creating and developing process, analysis and evaluation of this process Component 2: Students will either perform in and/or design for two key extracts from a performance text, externally assessed by a visiting examiner.",6,content,43
0,Component 3: Written examination:,9,logistics,6
0,1 hour 30 minutes.,12,logistics,5
0,An evaluation of a live performance and an analysis of a studied text.,14,logistics,14
1,"You will cover various topics including naturalistic theatre, devising and different theatrical genres made popular by a host of different theatre practitioners.",42,content,24
1,"You will develop your skills through working with other students to create performances, as well as independently.",25,content,19
1,"There are three components which are assessed by your teacher, and externally by a visiting examiner who will watch your final performance.",19,logistics,24
1,Each component includes performance and written work.,9,logistics,8
1,"A good drama student will have good descriptive written skills, will be able to evaluate their own performance work and will be able to keep a log of their developments.",48,motivation,32
1,"Students on this course will be expected to work with everyone and must be ready to perform in front of others, both during lesson and during possible concerts or other events.",25,content,33
1,Component 1 - Exploring the Performing Arts.,22,content,8
1,You will examine the work of performing arts professionals and document this through coursework and practical work.,24,content,18
1,Component 2 - Developing Skills and Techniques in Performing Arts.,22,content,11
1,You will develop their skills and techniques through both practical and written work.,26,transferrable,14
1,3 - Responding to a Brief.,5,content,7
1,"You will work as a group to create a piece of theatre, based on a performance brief.",40,content,19
2,"This acting course is suitable for students who have demonstrated a level of enthusiasm, motivation and dedication to performing arts and in particular drama.",39,content,26
2,Students choosing this course must be willing to perform.,21,transferrable,10
2,"Students gain a practical understanding of drama, and apply this knowledge to their performances as they develop their practical skills.",48,motivation,22
2,"Students can choose to be a performer or can take on the role of designer in lighting, sound, set or costume.",25,content,24
2,Students must choose one role throughout the component but can choose different roles.,27,logistics,14
2,There are 3 assessed components:,9,logistics,6
2,"Devising drama—Students research and explore a stimulus, work collaboratively and create their own devised drama.",47,content,18
2,"They complete a portfolio of evidence during the devising process, give a final performance of their drama, and write an evaluation of their own work.",47,content,28
2,This is an internal assessment 30% Component 03:,17,logistics,10
2,Presenting and performing texts—Students develop and apply theatrical skills in acting or design by presenting a showcase of two extracts from a performance text.,42,content,26
2,"This is an internal assessment 30% Component 04: Drama: Performance and response— Students explore practically a whole performance text, and demonstrate their knowledge and understanding of how drama is developed, performed and responded to.",34,content,41
2,They also analyse and evaluate a live theatre performance throughout the course.,33,content,13
2,This is a written external exam—40%,16,logistics,8
3,Why choose Drama?,43,motivation,4
3,"Drama remains one of the most popular GCSE examination choices in the country, because it is one of the few subjects which can demonstrate, to employers and university interviewers, a young person’s ability to work creatively and co-operatively within a group situation, to achieve a common goal.",0,content,53
3,"Students learn to collaborate with others, think analytically and evaluate effectively.",23,transferrable,13
3,"They gain the confidence to pursue their own ideas, reflect and refine their efforts.",31,transferrable,16
3,"Whatever the future holds, students of GCSE Drama emerge with a toolkit of transferable skills, applicable both in further studies and in the workplace.",0,content,27
3,"It offers preparation for students wishing to go on to do ‘A’ Level and degree courses in the Arts and promotes the development of personal and social skills, of vital importance in the world beyond education.",22,content,40
3,Aims of the Course,29,content,4
3,The course is designed to enable students to achieve: •,21,transferrable,11
3,Increased confidence in personal communication and presentation skills •,31,transferrable,9
3,"The development of creative, cognitive and imaginative abilities •",31,transferrable,10
3,Greater awareness of themselves as unique individuals and of their role within a group •,31,transferrable,15
3,A heightened sensitivity to the range of human experience •,31,transferrable,10
3,"Awareness of social, historical and cultural contexts and influences on drama and theatre •",46,content,15
3,"An appreciation of the ways in which playwrights achieve their effects and an ability to communicate an author’s intentions to an audience, through performance •",46,content,27
3,Skills in the shaping of dramatic performance •,46,content,8
3,A recognition of the contribution of design elements in theatre presentation •,42,content,12
3,An appreciation of the role of theatre in contemporary culture •,42,content,11
3,Understanding of how to critically evaluate theatre productions How We Begin,33,content,11
3,"The first 2 terms of the course are spent developing and diversifying students’ understanding of drama, through participation in practical workshops, exploring such key concepts as narrative structure, tension, focus and sub-text AND developing their skills in writing analytically about performance.",48,motivation,48
3,"They learn to work from a script, shape work of their own devising and reflect, in writing, upon their work and that of others.",31,transferrable,28
3,"Attending the theatre to witness different approaches to performance and design, is an ESSENTIAL part of learning – and assessment – in this subject.",40,content,26
3,"In the final examination, students are required to answer questions on performances they have attended on the course.",33,content,20
3,"The Drama Department organises several trips a year to carefully selected productions outside of Grantham, which are also a basis for work in class.",39,content,26
3,"Additionally, visits to Grantham’s own Guildhall are promoted and students will be expected to attend the school’s own annual drama production (unless they are appearing in it!)",39,content,33
3,What is Assessed?,3,logistics,4
3,"The AQA course presently followed by the department requires students during the course to demonstrate skills in the crafting of performance, showing awareness of social, historical and cultural influences upon their work and a recognition of how to work together creatively to develop a drama product.",39,content,49
3,"Students are also required, as part of this coursework, to reflect, in writing, upon those factors which influenced their practical work.",21,transferrable,26
3,"The final, written examination tests students’ ability to critically evaluate live theatre, which they have experienced as part of the course, together with their ability to think imaginatively and with sensitivity to22Shared:Y9 GCSE OPT – 21-23 text, as an actor or director in relation to play scripts studied.",33,content,56
3,"Students’ understanding of work is assessed through their ability to express their understanding orally, in writing, and through practical demonstration of their skills.",20,transferrable,27
3,"The subject content for GCSE Drama is divided into three components- Understanding Drama, Devising Drama and Texts in Practice.",0,content,22
3,Practical Assessment (60% of total marks),16,logistics,9
3,The practical assessment is broken up into two components - Devising Drama and Texts in Practice.,34,content,17
3,In the Devising Drama unit you are exploring the process of creating and performing devised drama as well as analysing and evaluating your own work.,47,content,26
3,It is assessed through a devising log (60 marks) and a devised performance (20 marks) and makes up 40% of the GCSE.,11,logistics,28
3,The Text in Practice unit requires a performance of two extracts from one play.,14,logistics,15
3,It is worth 20% of the GCSE The Terminal Exam 40% The final exam in Drama consists of a written paper lasting 1 hour and 45 minutes.,16,logistics,30
3,It is an open book exam worth 80 marks.,16,logistics,10
3,The exam assesses students’ knowledge and understanding of drama and theatre including a study of one set play from a choice of six and an analysis and evaluation of the work of live theatre makers.,33,content,37
3,Section A: multiple choice (4 marks) •,18,logistics,10
3,Section B: four questions on a given extract from the set play chosen (44 marks) •,32,content,19
3,"Section C: one two part question (from a choice) on the work of theatre makers in a single live theatre production (32 marks) Students are prepared for this through homework, class activities, theatre visits and mock exams during the course.",33,content,48
3,Failure to participate in theatre visits would place a student on this course at a severe disadvantage in the final exam,40,content,21
4,A BTEC in Performing Arts can help you take your first steps towards a career onstage or behind the scenes.,10,logistics,21
4,"You’ll learn essential skills such as acting, dance and musical performance, stage management, production and set design.",37,motivation,22
4,What skills will I develop and what will I study?,30,motivation,11
4,The qualification gives pupils the opportunity to develop sector-specific knowledge and skills in a practical learning environment.,30,motivation,18
4,The main focus is on four areas of equal importance which cover the: •,8,content,15
4,"Development of key skills that prove your aptitude in Performing Arts, such as reproducing repertoire or responding to stimulus.",24,content,21
4,"Process that underpins effective ways of working in the Performing Arts, such as development of ideas, rehearsal and performance. •",24,content,23
4,"Attitudes that are considered most important in the Performing Arts, such as the development of ideas, rehearsal and performance. •",24,content,23
4,"Attitudes that are considered most important in the Performing Arts, including personal management and communication.",24,content,17
4,"This Award complements extracurricular activities and any external lessons in drama, dance, music and singing.",35,motivation,18
5,What you will cover:,8,content,5
5,"By studying GCSE Drama, students will learn more about the subject and its contribution to social and cultural commentary and will come to appreciate that drama, provides significant opportunities for expressing cultural and personal identity.",0,content,38
5,"Through the study of Drama, students will be given opportunities to participate in and interpret their own and others’ drama.",48,motivation,23
5,"They will investigate the forms, styles, and contexts of drama and will learn to work collaboratively to develop ideas, to express feelings, to experiment with technical elements and to reflect on their own and others’ performances.",47,content,42
5,Students are required to study theatre practitioners such as Brecht and Stanislavski and be able to put their techniques into a devised and scripted performance.,38,content,26
5,"They will also study a set text, which promotes student’s enjoyment of drama as performers, devisers, directors and designers.",48,motivation,24
5,Drama GCSE provides opportunities for students to attend professional and community dramatic performances and to develop their skills as informed and thoughtful audience members.,0,content,25
5,Why choose this subject:,8,content,5
5,The course is for students who have a love of theatre and the acting process.,39,content,16
5,Students will be expected to perform devised and scripted work and deconstruct set texts and performances within written course work.,20,transferrable,21
5,This subject is worth one GCSE grade.,8,content,8
5,A significant number of Scalby School students have gone on to study A Level Drama and theatre studies or BTEC level 3 in Acting Studies.,10,logistics,26
5,"From here, students have been accepted into Drama schools and carved out a career in the Performing Arts or teaching.",48,motivation,22
5,"Other popular routes have included retail, travel and tourism, marketing, theatre, film, media or any career, which involves meeting people face to face.",40,content,30
5,Many employers now actively seek those who have studied the arts.,7,motivation,12
5,"Steve Jobs, founder of Apple, was fond of saying his success was due to his hiring artists and musicians fascinated by technology rather than computer geeks.",31,transferrable,29
5,"Top talent management agency, The Curve Group, specialising in financial and business services, declares that employees with arts degrees have developed more quickly in their roles from the start and has found them to have discipline, confidence and the ability to accept criticism.",26,transferrable,48
6,BTEC CERTIFICATE IN PERFORMING ARTS Equivalent to one GCSE (120 hours over Year 10 and 11),10,logistics,18
6,UNIT 1: INDIVIDUAL SHOWCASE (30 hours),28,logistics,9
6,This is a core unit that is externally marked.,18,logistics,10
6,Each learner will prepare and rehearse a solo performance that will be recorded.,25,content,14
6,They will have two hours under exam conditions to compose a letter of application describing their performance.,12,logistics,18
6,"UNIT 2: PREPARATION, PRODUCTION AND PERFORMANCE (30 hours)",28,logistics,12
6,You will develop a performance piece as a member of a fictional performance company.,38,content,15
6,"You will take on a performing or production role and will prepare for, and produce, a performance.",25,content,20
6,You will also need to explore the performance piece you are working on.,14,logistics,14
6,"This unit focuses on the work of a company, not just the individual.",5,content,15
6,It will give you the chance to experience the highs and lows of working as a member of a performance company.,25,content,22
6,UNIT 3: ACTING SKILLS (60 hours),37,motivation,9
6,This unit is about starting you on your journey to becoming a professional actor.,37,motivation,15
6,You will be introduced to important acting skills.,37,motivation,9
6,"In particular, you will undertake a programme of regular exercises to help you master the techniques that will enable you to control and use your voice and body for a character or role.",37,motivation,35
6,You will need to use your imagination to create characters or roles.,38,content,13
6,Actors interact with other actors/characters and with the audience and therefore they must be excellent communicators.,47,content,19
6,This unit is about building your foundations as an actor; it is not just about performance.,40,content,18
6,WHY TAKE DRAMA?,43,motivation,4
6,"As well as leading you into areas of performance and Expressive Arts in college, University or Drama School, a Drama qualification will be of great benefit in any career involving team work, team management, presenting, or dealing with the public in any way",45,transferrable,48
7,What is GCSE Drama ? •,0,content,6
7,"A vibrant, lively and enjoyable GCSE.",0,content,8
7,"Mostly practical, but with written homework, a portfolio and written exam.",6,content,14
7,Why should I choose Drama? •,43,motivation,7
7,Because you love drama and have a passion for creating interesting and thought provoking pieces of theatre. •,43,motivation,19
7,You are interested in a career in technical theatre production. •,36,motivation,12
7,You want to improve your confidence and communication skills.,31,transferrable,10
7,These are important transferable skills in any sector.,30,motivation,9
7,What will I do in Drama? •,44,transferrable,8
7,"You will create a piece of theatre from a stimulus, taking complete ownership over it. •",42,content,18
7,"You will study scripts from different viewpoints, whether that be actor, director or designer. •",40,content,18
7,"You will take part in rehearsals, workshops and theatre trips. •",40,content,13
7,You will live and breathe theatre.,33,content,7
7,What Coursework will I have to do? •,21,transferrable,9
7,"A performance created by students in small groups, based on given stimuli.",25,content,14
7,You will create and then perform your piece in front of an audience.,38,content,14
7,A portfolio and evaluation will also be completed.,6,content,9
7,"You will be given a play script and after weeks of rehearsal ,perform it to a visiting examiner and audience. •",40,content,23
7,Theatre Makers in Practice,41,content,4
7,"You will read and practically explore a play from the perspectives of an actor, director and designers.",42,content,19
7,You will also see a piece of live theatre and review it.,33,content,13
7,"At certain times during the course, lunchtime and/or after school rehearsals are compulsory.",40,content,17
7,You must be able to attend after school rehearsals if you select Drama as an option.,48,motivation,17
7,How will I be assessed? •,1,logistics,7
7,"Devised Performance—you will be assessed on practical performance, written portfolio and evaluation. •",6,content,17
7,Performance from Text—you will be assessed on your practical performance.,14,logistics,13
7,Theatre Makers in Practice—you will be assessed on a two part written exam looking at a chosen play text and a piece of live theatre seen.,33,content,29
7,What are the important deadlines in this course? •,28,logistics,10
7,Internally assessed and externally moderated—October of Year 11. •,3,logistics,11
7,Performance from Text –,14,logistics,4
7,March to May of Year 11. •,28,logistics,8
7,Theatre Makers in Practice –,41,content,5
7,Externally assessed as a written exam - May of Year 11.,2,logistics,12
8,"CAREER PATHWAYS: Actor, Artistic Director, Screenwriter, Comedian, Producer, Set designer, Presenter, Arts Administrator, Playwright, Stage Crew, Film Director, Scenic Artist, Publicist, Radio/TV broadcasting, Event promoter, Marketing.",36,motivation,45
8,GET IN TOUCH: ccorr@chiltern-academy.co.uk INSPIRE MINDS BY: •,10,logistics,10
8,Exposing pupils to great practitioners and works from a diverse range of styles and genres. •,25,content,17
8,"Placing a focus on performance of a different range of plays and stages, giving pupils the opportunity to explore drama •",48,motivation,22
8,"Offering pupils the chance to be creative and imaginative through opportunities involving performance, presentation, directing and script writing. •",25,content,22
8,"Building a space for challenging and thoughtful discussions and debate, allowing pupils to explore different viewpoints and perspectives. •",23,transferrable,21
8,"Encouraging independent learning and creativity,allowing pupils to have freedom.",25,content,12
8,BUILD FUTURES BY: •,8,content,5
8,"Gaining a broad understanding of drama/acting as a vocation, with an insight into careers available in the Arts, theatre, broadcasting and more. •",35,motivation,29
8,"Developing skills prized by employers in all sectors such as independence, research and problem-solving skills. •",30,motivation,20
8,"Boosting your ability to communicate and work as part of a team, with frequent opportunities to work collaboratively in a creative setting. •",31,transferrable,25
8,"Using creative skills such a ‘script writing’ for learning and creating, equipping pupils with skills of literacy that are extremely valuable to employers and are relevant to many aspects of everyday life.",26,transferrable,37
8,FULL COURSE SPECIFICATION AND DETAILS CAN BE FOUND HERE: BTEC Performing Arts,10,logistics,13
9,What does GCSE Drama involve?,0,content,6
9,To study Drama you must have a keen interest in the subject.,45,transferrable,13
9,Drama involves group work but one of the biggest challenges you will face is the confidence to perform alone and the ability to work independently.,44,transferrable,26
9,You will need to be resilient and understand it takes hard work and commitment to improve.,31,transferrable,17
9,"Lastly creativity is one of the key skills you will need, so don’t be afraid to experiment and make mistakes, this is all part of the learning process.",24,content,32
9,"Drama is a practical course which allows you to learn and develop performance and devising skills, however 70% of the course is written so you will need to consider this when opting.",45,transferrable,35
9,"It is open to all students, although some experience of drama is necessary.",48,motivation,15
9,It is essential that students commit to extra-curricular sessions to rehearse and develop their skills.,23,transferrable,16
9,"You will often work in groups and develop skills such as, confidence and presentation skills which are transferable to other subjects and areas of life.",31,transferrable,27
9,What will I study?,4,content,5
9,The course is split into three components:,27,logistics,8
9,"Performance, Devising and Drama Appreciation.",47,content,7
9,Devising Drama = 30%,44,transferrable,5
9,"You will research and explore a stimulus, working collaboratively to create your own devised piece.",14,logistics,17
9,Alongside the practical element you also write a portfolio reflecting and evaluating on your process and finished piece.,6,content,19
9,This unit is broken down in the following way: 20% written portfolio and 10% practical performance.,6,content,20
9,Presenting and performing texts = 30%,11,logistics,7
9,You will develop and apply theatrical skills in acting by presenting a showcase of two extracts from a scripted piece of text.,42,content,23
9,"We are currently using the scripts ‘Things I know to be true’, ‘Girls like That’, ‘Teechers’ and ‘Curious Incident of the Dog in the Night-time’.",32,content,37
9,This unit is broken down in the following way: 20% practical performance to a visiting examiner and 10% written concept pro forma.,11,logistics,26
9,Drama Appreciation = 40% (90 minute written paper) The paper is in two sections- Section A: You will explore and analyse the performance text ‘Blood Brothers’ to demonstrate your knowledge and understanding of Drama.,34,content,42
9,This section of the paper is marked out of 50.,16,logistics,11
9,Section B: Is an essay response analysing and evaluating a piece of live theatre.,33,content,16
9,This section of the paper is marked out of 30,16,logistics,10
10,Brief outline of the course:,29,content,6
10,This includes two pieces of practical work: one of which is a performance of two extracts from a text and one which is a devised piece from a given stimulus.,14,logistics,32
10,"Students also have to study a separate set text, ‘Blood Brothers’ by Willy Russell, and will have to watch a live performance of a different play to evaluate for their written examination.",32,content,37
10,Subject Content: See above.,8,content,6
10,Teaching and Learning styles involved:,21,transferrable,6
10,Teacher led study of texts and written technique.,20,transferrable,9
10,"Practical work in groups, which is essentially student led.",23,transferrable,11
10,High levels of self-discipline and concentration will be required whilst an ability to work closely with others is essential.,31,transferrable,22
10,The devised practical work is internally assessed and externally moderated.,19,logistics,11
10,"Pupils must produce an accompanying devising log which is either written, recorded, or both.",13,content,17
10,The devised work overall is out of 80 marks.,16,logistics,10
10,"The performance of two extracts from one text will be marked by a visiting examiner, and is out of 40 marks.",11,logistics,23
10,The written exam paper is marked externally and is out of 80 marks.,16,logistics,14
10,Examination Level: Examination Board: AQA GCSE Grades 9-1 Details of exam components:,17,logistics,17
10,40% Devised Practical Performance including the devising log.,16,logistics,10
10,20% Text Performance 40% Written Exam – 1 ¾ hour paper Details of coursework components:,11,logistics,18
10,"Coursework involves learning lines, preparation for performances and the devised work, and the study of a set text.",21,transferrable,21
10,"However, there will be ongoing written practice coursework in preparation for the written exam.",16,logistics,16
10,"How is ICT used: Students use the internet to research plays, films and literature in order to prepare both their coursework and practical work.",20,transferrable,27
10,Any special requirements:,30,motivation,4
10,Students need to understand that they will have to perform on stage in front of live audiences and be able to work successfully within a team.,38,content,27
10,Excellent attendance is therefore essential.,26,transferrable,6
10,Theatre trips take place throughout the course to see professional work and exam-based plays.,40,content,17
10,"In addition, there may be an opportunity to attend workshops.",13,content,12
10,There will be costs involved with these.,8,content,8
10,What the pupils say: “Year 10 and 11 Drama is very different to KS3.,47,content,17
10,You need the drive to entertain.”,33,content,8
10,“It is fun because you work with your friends doing something different from other lessons.’,23,transferrable,18
