description_id,sentence,cluster,cluster_type,n_tokens
28,Some people may be of the opinion that you don’t need drama for a particular job but it does relate to all of them!,43,motivation,26
28,"As well as learning about drama, students will also develop their personal and social skills.",48,motivation,17
28,This includes;  confidence  team working skills  presentation skills  communication skills  confidence  team working skills  presentation skills  communication skills,31,transferrable,27
28,These are all really desirable skills that an employer will look for in their employee.,30,motivation,16
28,It also looks really good on your CV which is the first point of contact when applying for jobs.,13,content,20
28,The above skills are essential in any job.,30,motivation,9
28,How will I be assessed?,1,logistics,6
28,You will explore a stimulus provided by the exam board.,2,logistics,11
28,You will work in groups to create your own devised drama based on your exploration.,44,transferrable,16
28,You will work as a performer creating a portfolio and a final performance.,6,content,14
28,Non- examined assessment 30% 20% Portfolio 10% Performance Presenting and Performing Texts,6,content,16
28,You will explore a text and perform two scenes to a Visiting Examiner.,12,logistics,14
28,You will work as a performer completing a pro forma and a final performance showcase.,37,motivation,16
28,Non- examined assessment 30% 20% Performance 10% Written pro-forma Drama: Performance and Response Section,34,content,19
28,A contains questions based on the study of a full text from a list set by the exam board.,17,logistics,20
28,Section B contains an extended response analysing and evaluating live theatre.,33,content,12
28,Written Exam 1½ hours 40% Progression,16,logistics,7
28,This course leads onto GCE Drama & Theatre Studies and/or BTEC Level 3 Acting.,10,logistics,17
28,"For more information please contact - Miss A Pickles, Mr C Hornsby & Miss R Venus",18,logistics,17
29,GCSE drama Component 1 devising (40% of the qualification),0,content,12
29,You will work in a group to create and develop a devised piece of theatre from a stimulus given to you by your teacher.,42,content,25
29,"For example, this could be a newspaper article, song, picture or poem.",6,content,16
29,"Assessment of this unit will take two forms, your performance of the piece to an audience and a portfolio which covers the creating and developing process as well your analysis and evaluation of the process.",6,content,37
29,The portfolio can either be a written document between 750 –,6,content,11
29,1000 words or a verbal presentation lasting between 8 – 10 minutes or a combination of the two.,12,logistics,19
29,Component 2 performance from text (20% of the qualification),15,logistics,12
29,"You will work in a group and develop, rehearse and perform two extracts from existing play texts which will be chosen by your teacher.",25,content,26
29,This unit will be assessed by a visiting examiner.,2,logistics,10
29,On the examination day you will perform your piece to an audience.,40,content,13
29,"You will gain marks for voice, movement, characterisation and communication within the performance.",37,motivation,16
29,Component 3 theatre makers in practice (40% of the qualification),41,content,13
29,You will study one complete play text chosen by the centre.,32,content,12
29,The exploration will take place through practical workshop sessions as well as theory based lessons.,13,content,16
29,As part of this unit you will also go and see a live theatre performance and evaluate this as an audience member.,33,content,23
29,"Again, you will work on this in workshop sessions in class.",13,content,13
29,The unit culminates in a written examination which is 1 hour and 30 minutes long.,12,logistics,16
29,In the examination you will answer six question on an extract from the set play text you have studied and two questions on the live performance you went to see.,33,content,31
29,You are allowed to take in 500 words of notes for the live evaluation section of the examination.,12,logistics,19
30,"Aim: The GCSE in Drama is an exciting, inspiring and practical course.",0,content,15
30,"The specification promotes involvement in and enjoyment of drama, as performers and/or designers.",46,content,17
30,"Additionally, it provides opportunities to attend live theatre performances and to develop skills as informed and thoughtful audience members.",40,content,21
30,"This GCSE in Drama will enable learners to apply knowledge and understanding when making, performing and responding to drama.",0,content,21
30,What will I learn?,4,content,5
30,The course has 3 Components:,27,logistics,6
30,Component 1 - Devising,14,logistics,4
30,"You participate in the creation, development and performance of a piece of devised theatre in response to a set stimulus based on either the work of a theatre practitioner or a genre.",42,content,34
30,You will then complete a written portfolio documenting the process and also an evaluation of your final performance.,6,content,19
30,Component 2 - Performing from a Text: You will participate in two performances from a performance text of your own choice.,15,logistics,23
30,This will then be performed to a visiting examiner.,2,logistics,10
30,Component 3 - Interpreting,9,logistics,4
30,"You will complete a written examination based on a set text studied and an evaluation of one live theatre production, seen during the course.",33,content,26
30,How will I learn?,4,content,5
30,"You will learn on the course through practical exploration of set texts and stimuli, along with chosen scripts.",20,transferrable,20
30,This will be within workshops and rehearsals which then develop into final performances to invited audiences.,40,content,17
30,"The course requires you to work in groups, use your own initiative and demonstrate discipline thorough-out rehearsals.",21,transferrable,21
30,What homework can I expect?,17,logistics,6
30,You will be expected to participate within research based on the performance/play being studied along with learning lines and performance preparation.,25,content,24
30,"You will also be required to complete written evaluations of practical work, live theatre reviews and written questions linked to set texts.",33,content,24
30,Exam 60% Internal Assessment 40% Additional Requirements,16,logistics,9
30,You will complete three units on the course.,27,logistics,9
30,Two are externally marked and assessed and one is marked internally.,2,logistics,12
30,Component 1 - Internally Assessed Component,9,logistics,6
30,2 - Practical performance of two chosen texts.,14,logistics,9
30,Externally assessed (by visiting examiner),2,logistics,7
30,Component 3 - Written examination.,9,logistics,6
30,What qualification will I get?,30,motivation,6
31,GCSE Drama follows the EDUQAS syllabus.,0,content,7
31,The course requires students to work in a group to devise and create an original performance in the style of a theatre practitioner or genre they study in Year 10.,38,content,31
31,"The second element of the course requires students to prepare an extract of a published play (again, working in a group), and perform this to a visiting examiner during Year 11.",33,content,36
31,"The third and final aspect of the course is to sit a written exam focussing on a set text they have studied and explored practically throughout the two year course,as well as evaluate a live theatre performance they have seen throughout the course.",33,content,46
32,Why study Drama?,45,transferrable,4
32,You should study Drama if you enjoy: •,45,transferrable,9
32,participating in group work and leading others •,26,transferrable,8
32,having the opportunity to be creative and imaginative in devising your own work •,31,transferrable,14
32,exploring a variety of plays.,33,content,6
32,"You will gain a good knowledge and understanding of different practitioners, styles of drama and drama techniques, exploring how they are effective in performance.",47,content,27
32,The course will cover,29,content,4
32,"The forms, styles, and contexts of drama and you will learn to work collaboratively to develop ideas, to express feelings, to experiment with technical elements and to reflect on your own and others’ performances.",47,content,40
32,The course provides opportunities for you to attend professional performances and to develop your skills as informed and thoughtful audience members.,39,content,22
32,You will be given opportunities to participate in and interpret your own and others’ drama.,44,transferrable,17
32,"It promotes your involvement in and enjoyment of drama as performers, devisers, directors and designers.",47,content,18
32,"You can opt for this subject as an Acting candidate, but also a Design candidate where you can specialise in either lighting, sound or costume design.",37,motivation,29
32,School contact Miss Hadley Exam board OCR Subject code J316 Qualification number 601/8975/7 Component Weighting Duration 1 Devised performance 30% Performance 2 Presenting and performing text 30% Performance 3 Performance and response 40% 1 hour 30 mins,16,logistics,40
33,Course outline Throughout Year 10 students will work to recall some of the skills learnt in KS3 and develop an understanding of theatre practice.,38,content,25
33,"We will look at various practitioners and their work, and begin to use some of their theory within practical.",13,content,21
33,"Students will develop their understanding of Theatre of Cruelty, Naturalism, Epic Theatre, Theatre in Education and Physical Theatre.",48,motivation,22
33,"Students will have opportunity to develop their acting skills, as well as explore puppetry, mask work and theatre production.",38,content,22
33,"All students will be required to act throughout the length of the GCSE, and whilst there will be some elements of production and design (lighting & sound) this will not form a main focus.",0,content,38
33,Is Drama for you?,43,motivation,5
33,The course will demand that students are organised individuals who understand the requirement to learn lines alongside completing set homework tasks.,21,transferrable,22
33,"Whilst it will not be every week, students will be expected to attend rehearsals out of the usual school day as per a set timetable as deadlines and examinations approach.",40,content,32
33,"Students will develop problem solving skills, the ability to think on the spot, and challenge their interpersonal skills.",23,transferrable,21
33,"Opting for Drama will require students to be a team player with a want to contribute ideas, lead, challenge and develop.",48,motivation,24
34,Why study Drama?,45,transferrable,4
34,"GCSE Drama will allow pupils to explore a range of drama as a practical art form, allowing pupils to create their own drama performances, study plays and evaluate the work of others.",0,content,35
34,As well as developing confidence and knowledge you will also cultivate the following skills: * Acting skills * How to make informed artistic choices * Drama techniques and terminology *,37,motivation,31
34,How to create and develop drama * Group work and collaboration skills * How to evaluate the work of others * Understand the dramatic potential of the text * Time management and problem-solving skills,48,motivation,36
34,*How to write formally about texts and live performance,14,logistics,10
34,What pathways does this subject lead to after Year 11?,28,logistics,11
34,"As well as being a perfect pathway for Drama/ Theatre and Performance courses, the confidence, presentational and analytical skills you will gain are transferable to many different areas.",37,motivation,32
34,"The broad nature of the course would also give students knowledge and skills to work in all areas of Theatre- design, technical, management as well as performance.",39,content,31
34,How will you be assessed?,1,logistics,6
34,Component 1: Devising Coursework 40% 1) a portfolio covering the creating and developing process and analysis and evaluation of this process – this can be written or videoed.,6,content,32
34,2) a devised performance/design realisation Component 2: Performance from Text Coursework 20% •,14,logistics,18
34,Performance/design realisation covering both key extracts – visiting examiner Component 3: Theatre Makers in Practice 40 % - Written examination:,33,content,24
34,1 hour 45 minutes •,12,logistics,5
34,Practical exploration and study of one complete performance text. •,14,logistics,11
34,Live theatre evaluation – free choice of production.,33,content,9
34,How can your parents/ carers help you with this course?,21,transferrable,12
34,Taking you see live theatre as much as possible!,33,content,10
34,"Exam board, specification and level of qualification Pearson Edexcel Level 1/Level 2 GCSE (9 - 1) in Drama (1DR0) Who is the contact in school for more information?",0,content,36
35,What is included in the course?,29,content,7
35,The BTEC Acting course is a very practical course that explores the skills of an actor.,10,logistics,17
35,You will train as an actor and participate in lots of staged performances to different audiences.,37,motivation,17
35,The course relies heavily on you working and co-operating as part of a team as you will be staging a range of performances in groups including all the technical aspects of putting on a performance.,21,transferrable,36
35,The course consists of 3 components which are split up over the three years.,27,logistics,15
35,They cover the following areas: •,8,content,7
35,Exploring the Performing Arts industry •,22,content,6
35,Presenting findings through a presentation •,5,content,6
35,Developing acting skills and techniques •,37,motivation,6
35,Performing devised and scripted plays •,42,content,6
35,Participating in a variety of workshops •,13,content,7
35,Performing to a brief •,5,content,5
35,How will I be assessed?,1,logistics,6
35,"Your work will be assessed both internally, by your teachers and externally, by the exam board.",19,logistics,19
35,Assessed work will consist of the following: •,19,logistics,9
35,What grades are available?,19,logistics,5
35,Course title - BTEC Level 2 Tech Award in Performing Arts: Acting Students can be awarded the following grades on the tech award and below is the equivalency to GCSE •,10,logistics,32
35,Level 1 Pass - 1 •,18,logistics,6
35,Level 1 Merit - 2 •,18,logistics,6
35,Level 1 Distinction - 3 •,18,logistics,6
35,Level 2 Pass - 4 •,18,logistics,6
35,Level 2 Merit - 5/6 •,18,logistics,8
35,Level 2 Distinction - 7 •,18,logistics,6
35,Level 2 Distinction* - 8/9 Possible next steps Students wanting to progress further with Acting Skills can go on to Level 3 or A Level course at college.,36,motivation,32
35,Then go on to study a BA Hons Degree in Acting/Drama at University.,35,motivation,16
35,Skills Developed • Confidence •,31,transferrable,5
35,Working from a Stimulus •,14,logistics,5
35,Ability to realise ideas •,31,transferrable,5
35,Independence Career Opportunities •,7,motivation,4
35,Actor - TV Film •,36,motivation,5
35,Actor - Theatre Performer •,37,motivation,5
35,Artistic Director • TV Film Critic •,37,motivation,7
35,"Production roles in theatre, TV and film •",36,motivation,9
36,"If you enjoy Drama, Dance, Musical or Theatrical Theatre, this could be the course for you.",39,content,20
36,The BTEC Technical Award is the equivalent of one GCSE.,10,logistics,11
36,"This course is focused on ‘Performance’ and offers a wide range of options in the three disciplines of Drama, Dance and Musical Theatre.",39,content,27
36,"You will gain experience of the understanding, knowledge and skills associated with practices and processes of the performing arts industry and acquire a general view of the variety of skills required for stage performance.",24,content,36
36,There are 3 components to complete during the course: Component 1:,27,logistics,13
36,Exploring the Performing Arts,22,content,4
36,This is internally assessed.,2,logistics,5
36,Learners will develop their understanding of the performing arts by examining practitioners’ work and the processes used to create performance.,24,content,22
36,Component 2: Developing skills and technique in Performing Arts,22,content,10
36,This is internally assessed.,2,logistics,5
36,Learners will develop their performing arts skills and techniques through the reproduction of musical theatre repertoire.,25,content,17
36,Component 3: Performing to a brief,5,content,7
36,This is externally set and assessed by the examining body.,2,logistics,11
36,Learners will be given the opportunity to work as part of a group to create a workshop performance in response to a given brief and stimulus.,25,content,27
36,Students who take either GCSE Drama or the BTEC Technical Award in Performing Arts will be able to progress to A Level Drama and Theatre Studies or BTEC Nationals Level 3 Performing Arts courses that we offer in the Sixth Form,10,logistics,41
37,The Eduqas GCSE Drama specification combines practical performance alongside a comprehensive introduction to theatre.,0,content,15
37,"It is an exciting, inspiring and practical course that promotes involvement in, and enjoyment of Drama, as performers and designers.",39,content,24
37,Additionally it provides opportunities to attend live theatre performances and to develop skills as informed and thoughtful audience members.,40,content,20
37,The course is divided into three main areas:,27,logistics,9
37,Learners are assessed on either acting or design.,38,content,9
37,"They participate in the creation, development and performance of a piece of devised theatre using either the techniques of an influential theatre practitioner or a genre, in response to a stimulus set by the board.",42,content,38
37,Learners need to produce the following for assessment: •,17,logistics,10
37,A realisation of their piece of devised theatre •,42,content,9
37,A portfolio of supporting evidence •,6,content,6
37,An evaluation of the final performance or design Performing from a Text:,14,logistics,13
37,Learners study two extracts from the same play and participate in a performance using sections from both extracts.,32,content,19
37,They will be assessed on acting or design.,40,content,9
37,A 90-minute written examination.,12,logistics,7
37,Section A: Students answer a series of questions on the 1989 play Hard to Swallow by Mark Wheeler.,32,content,20
37,"In preparation, learners will explore the text practically as a performer, designer and director.",20,transferrable,17
37,"Section B: Learners answer one question, from a choice of two, requiring analysis and evaluation of a given aspect of a live theatre production seen during the course.",33,content,32
37,"Skills and knowledge you will need Drama is about creativity, communication and cooperation.",44,transferrable,15
37,It is a collaborative art form and throughout the course students will be required to create work as a team.,25,content,21
37,"Public performance is a requirement of the course, and all students will have an assessed performance every term.",19,logistics,20
37,"Drama develops your evaluative and analytical skills, encourages you to take risks and think beyond yourself, exploring a wide variety of contexts.",44,transferrable,25
37,Assessment Drama is assessed both practically and theoretically: •,34,content,10
37,Devising Theatre (40% of GCSE) •,0,content,9
37,Performing from a Text (20% of GCSE) •,11,logistics,11
37,Interpreting Theatre (40% of GCSE) 90-minute written examination Progression GCSE Drama is perfect preparation for A Level Drama and Theatre Studies; Vocational A Level in Performing Arts; BTEC National Certificate or Diploma in Performing Arts; Performance Design and Technology.,0,content,48
37,"Drama is also ideal preparation for any other A Level course that requires textual analysis, evaluation and interpretation of source material.",45,transferrable,23
37,Specification Awarding body and Specification Number: Eduqas (601/8420/6,17,logistics,12
38,The course is suitable for students with a genuine interest in drama and theatre.,39,content,15
38,You must enjoy group work and have excellent punctuality and attendance.,26,transferrable,12
38,Drama students should enjoy the challenge of practical drama work and be interested in learning about technical and design aspect of theatre.,48,motivation,23
38,"You will learn to write reflectively, analytically and creatively.",20,transferrable,11
38,"You should be self-motivated and able to carry out independent research, complete detailed notes on practical sessions, homework and coursework tasks set, as well as organise and run rehearsals out of lessons.",25,content,38
38,Will I enjoy the course?,21,transferrable,6
38,You will enjoy this course if you are prepared to work hard and you want to study a subject that is both practical and creative.,21,transferrable,26
38,You may have done some acting before or helped out backstage on a production.,37,motivation,15
38,"You may have always wanted to have a go directing a play, performing, making costumes, building a set or operating the lights but never had the chance.",41,content,31
38,You will enjoy this course if you enjoy working as part of a team as drama involves a lot of group work.,45,transferrable,23
38,"But be warned, it is not a soft option!",20,transferrable,11
38,What could I do next with GCSE Drama?,0,content,9
38,How does it follow on from what I have learned before?,4,content,12
38,GCSE Drama follows on from drama work that you may have done at Key Stage 3.,0,content,17
38,You will develop your improvisation and acting skills to a higher level.,37,motivation,13
38,You can pursue theatrical design and technical options if those are your strengths.,36,motivation,14
38,"You will look at plays in more detail, both in the studio and at the theatre, and look at different ways of bringing a script to life on stage",42,content,31
38,What about my results?,14,logistics,5
38,"As well as acquiring the skills involved in creating and performing drama, you will also be able to acquire skills in working with others, problem solving and communication.",44,transferrable,31
38,You will also find that drama will help you feel more self- confident and prepare you to deal with a range of different situations and people.,44,transferrable,28
38,What’s in the exam Specification?,17,logistics,7
38,This exam is taken in the summer of Year 11 Component 1: Devising Theatre Practical work–,33,content,18
38,Internally assessed 60 marks/40% Learners devise a piece of original theatre in response to a stimulus using either acting or design.,33,content,25
38,You will be required to produce a portfolio of supporting evidence of the rehearsal process and evaluate the final performance.,25,content,21
38,Component 2 Performing from Text Practical work- externally assessed by visiting examiner 60 marks/20% Learners participate in the performance from a text assessed as either acting or designing Component 3: Written Paper – 1 hour 30mins – 60 marks 40%,11,logistics,47
38,The written paper comprises three sections: A– Set Text – answer a series of questions related to performance of the set text studied.,14,logistics,26
38,45 marks B– Live Theatre Review – an analysis and evaluation of a given performance aspect of a production seen.,33,content,22
38,15 marks 24 There are many things you can go on to do with a GCSE in Drama.,0,content,19
38,"If you are unsure about what to do next, the best thing to do is to speak to your drama teacher who will know about the choices on offer.",45,transferrable,31
38,"You could go on to take an AS or Advanced GCE in Drama and Theatre Studies, or an Advanced Vocational Certificate of Education in Performing Arts or a BTEC National Certificate or Diploma in Performing Arts.",10,logistics,38
38,"You may wish to take a GCSE in Drama for its own sake, perhaps to form the basis of a future interest or as part of a range of other subjects.",0,content,33
38,"You might wish to use some of the skills developed during this course to enhance your career prospects, especially any career that involves meeting people face to face.",21,transferrable,30
38,The study of drama can help you develop transferable skills you can take into any career or job.,45,transferrable,19
38,Careers Drama provides you with the widest possible range of transferable skills of any subject.,35,motivation,16
38,"Drama can equip you for any profession where you need good communication skills, creative thinking, work as part of a team, analytical skills etc.",44,transferrable,28
38,"Possible careers include: practising law; practising medicine; teaching; performing; directing; theatre administration; theatre design; sound and lighting technician; social worker; therapist; management training; education officer in theatres, art galleries, museums and other public institutions.",36,motivation,49
38,Specific careers linked with Drama are:,35,motivation,7
38,"Theatre, TV and film work including performance, make-up, costume, set design, technical professions such as stage management, lighting and sound technicians, directors, producers, radio, multi-media, teaching, Drama Therapy and ANY career that requires good commitment, team work and presentation skill",36,motivation,55
39,What is it?,18,logistics,4
39,"GCSE Drama is a highly appealing course due to the diverse range of activities, combining both practical and theoretical approaches to learning.",0,content,24
39,GCSE Drama enables students to learn and hone a variety of dramatic skills and techniques whilst developing students’ knowledge of key dramatic genres.,0,content,25
39,"In addition to this, students will be given the opportunity to explore real life in a safe environment, preparing them for the wider world.",20,transferrable,27
39,Why should I take it?,8,content,6
